{
  "specversion": "1.0",
  "id": "019a0b10-7c1e-7b8a-9d40-2f6c1a0b7e02",
  "source": "dev.hauskraft.core",
  "type": "hauskraft.user.updated",
  "subject": "user/0199f391-3333-7aaa-8bbb-dddddddddddd",
  "time": "2026-10-22T18:00:00.000Z",
  "datacontenttype": "application/json",
  "dataschema": "https://hauskraft.dev/schema/events/user.updated/v1.json",
  "dataclass": "personal",
  "actorid": "0199f390-2222-7aaa-8bbb-cccccccccccc",
  "data": {
    "user": {
      "id": "0199f391-3333-7aaa-8bbb-dddddddddddd",
      "username": "alex",
      "display_name": "Alex M.",
      "role": "adult"
    },
    "changes": {
      "display_name": {
        "from": "Alex",
        "to": "Alex M."
      }
    }
  }
}
