{
  "specversion": "1.0",
  "id": "019a0b10-7c1e-7b8a-9d40-2f6c1a0b7e08",
  "source": "dev.hauskraft.core",
  "type": "hauskraft.settings.household_changed",
  "subject": "setting/household",
  "time": "2026-10-22T18:00:00.000Z",
  "datacontenttype": "application/json",
  "dataschema": "https://hauskraft.dev/schema/events/settings.household_changed/v1.json",
  "dataclass": "household",
  "actorid": "0199f390-2222-7aaa-8bbb-cccccccccccc",
  "data": {
    "changes": {
      "name": {
        "from": "Familie Müller",
        "to": "Familie Müller-Schmidt"
      },
      "timezone": {
        "from": "Europe/Berlin",
        "to": "Pacific/Kiritimati"
      }
    }
  }
}
